{
  "candidate": {
    "name": "Alex Chen",
    "email": "alex@example.com",
    "phone": "+1-555-0123",
    "location": "Austin, TX",
    "linkedin": "https://linkedin.com/in/alexchen",
    "github": "https://github.com/alexchen",
    "portfolio": "https://alexchen.dev"
  },
  "job": {
    "company": "Acme AI",
    "role": "Senior AI Platform Engineer",
    "url": "https://jobs.example.com/acme-ai"
  },
  "metadata": {
    "approvedByUser": true,
    "paperFormat": "letter",
    "renderEngine": "latex",
    "language": "en",
    "generatedAt": "2026-04-30T00:00:00.000Z"
  },
  "sections": {
    "summary": {
      "text": "AI platform engineer with six years building **production ML systems**, **model monitoring**, and **evaluation workflows**.",
      "sourceIds": ["cv-current", "project-eval-toolkit"]
    },
    "competencies": [
      {
        "text": "**LLM evaluation**",
        "sourceIds": ["project-eval-toolkit"]
      },
      {
        "text": "**ML platform engineering**",
        "sourceIds": ["cv-current"]
      }
    ],
    "education": [
      {
        "title": "MS Computer Science",
        "subtitle": "Machine Learning Systems",
        "period": "2018",
        "location": "Austin, TX",
        "coursework": ["Distributed Systems", "Applied Machine Learning"],
        "sourceIds": ["cv-current"]
      }
    ],
    "experience": [
      {
        "company": "TechFin Corp",
        "role": "Senior ML Engineer / ML Platform Lead",
        "period": "2020 -- 2024",
        "location": "Austin, TX",
        "bullets": [
          {
            "text": "Engineered **production model registry**, deployment, monitoring, and retraining workflows used by multiple engineering teams.",
            "sourceIds": ["cv-current"]
          },
          {
            "text": "Reduced model deployment time from **two weeks to four hours** by building CI/CD paths for tested model releases.",
            "sourceIds": ["cv-current"]
          }
        ]
      }
    ],
    "projects": [
      {
        "name": "LLM Eval Toolkit",
        "description": "Built an open source evaluation framework for LLM applications with custom metrics and CI regression checks.",
        "tech": "Python | LLM evals | CI",
        "github": "https://github.com/alexchen/llm-eval-toolkit",
        "bullets": [
          {
            "text": "Developed **custom evaluation metrics** and regression checks for 100% deterministic Python_A & Python_B release comparisons.",
            "sourceIds": ["project-eval-toolkit"]
          }
        ],
        "sourceIds": ["project-eval-toolkit"]
      }
    ],
    "leadership": [],
    "skills": [
      {
        "category": "AI/ML",
        "items": ["LLM evaluation", "model monitoring", "ML platforms"],
        "sourceIds": ["cv-current", "project-eval-toolkit"]
      },
      {
        "category": "Engineering",
        "items": ["CI/CD", "distributed systems", "observability"],
        "sourceIds": ["cv-current"]
      }
    ]
  }
}
